{
  "schemaVersion": "benchmark-trial-v1",
  "benchmarkVersion": "openfront-bench-v0.1",
  "manifestHash": "f5b931094973115a036ee8f7bea5c92d2012d62b7d77f99e97c4facd0ee66a60",
  "runId": "49e3d63c-0c3c-48f0-92b2-570571df62d7",
  "trialId": "f99703b2-076d-4640-9c56-8853a35ec27a",
  "taskId": "cap-split-front-prioritization-scored-europe-classic-001",
  "suite": "capability",
  "split": "scored",
  "status": "valid",
  "invalidReason": null,
  "model": {
    "requested": "z-ai/glm-5.2",
    "resolved": "z-ai/glm-5.2",
    "provider": "Baidu",
    "requestedProvider": "baidu",
    "promptVersion": "agent-v13",
    "reasoningEffort": "none"
  },
  "startedAt": "2026-08-07T07:35:55.978Z",
  "completedAt": "2026-08-07T07:36:01.834Z",
  "hashes": {
    "checkpoint": 7085039232693999,
    "final": 9081791686670040
  },
  "attempts": {
    "failures": [],
    "timings": [
      {
        "attempt": 1,
        "totalMs": 3986.442042,
        "timeToFirstTokenMs": 1919.2048329999998,
        "generationMs": 2067.2372090000003,
        "completionTokens": 38,
        "timePerOutputTokenMs": 55.871275918918926,
        "queueMs": null,
        "generationId": "gen-1786088157-vDikk0ujZWuRnXFjECzL"
      }
    ],
    "fallback": false
  },
  "usage": {
    "promptTokens": 2774,
    "completionTokens": 38,
    "costUsd": 0.0010393152
  },
  "assertions": [
    {
      "id": "player-alive",
      "observed": true,
      "operator": "=",
      "threshold": true,
      "passed": true
    },
    {
      "id": "priority-frontier-held",
      "observed": 43,
      "operator": "<=",
      "threshold": 100,
      "passed": true
    },
    {
      "id": "combined-frontier-loss-limited",
      "observed": 224,
      "operator": "<=",
      "threshold": 300,
      "passed": true
    }
  ],
  "diagnostics": {
    "finalTick": 3703,
    "finalTileCount": 271338,
    "finalTroops": 2871543,
    "finalTroopCapacityPercent": 67.72038742869316,
    "initialTileCount": 273309,
    "initialTroops": 2393873,
    "initialTroopCapacityPercent": 56.24521717560135,
    "territoryChange": -1971,
    "terminal": false
  },
  "componentCoverage": 1,
  "taskScore": 100,
  "artifactPath": "artifacts/f99703b2-076d-4640-9c56-8853a35ec27a.capability.json.gz"
}
