{
  "schemaVersion": "benchmark-trial-v1",
  "benchmarkVersion": "openfront-bench-v0.1",
  "manifestHash": "f5b931094973115a036ee8f7bea5c92d2012d62b7d77f99e97c4facd0ee66a60",
  "runId": "49e3d63c-0c3c-48f0-92b2-570571df62d7",
  "trialId": "c6f4c0c9-0a7e-4ba2-855f-09df86222a98",
  "taskId": "cap-construction-failure-recovery-scored-europe-classic-001",
  "suite": "capability",
  "split": "scored",
  "status": "valid",
  "invalidReason": null,
  "model": {
    "requested": "z-ai/glm-5.2",
    "resolved": "z-ai/glm-5.2",
    "provider": "Baidu",
    "requestedProvider": "baidu",
    "promptVersion": "agent-v13",
    "reasoningEffort": "none"
  },
  "startedAt": "2026-08-07T05:19:42.432Z",
  "completedAt": "2026-08-07T05:19:48.043Z",
  "hashes": {
    "checkpoint": "10050961651835828",
    "final": 11266520856435276
  },
  "attempts": {
    "failures": [],
    "timings": [
      {
        "attempt": 1,
        "totalMs": 2717.6302910000004,
        "timeToFirstTokenMs": 1861.0749159999996,
        "generationMs": 856.5553750000008,
        "completionTokens": 56,
        "timePerOutputTokenMs": 15.573734090909106,
        "queueMs": null,
        "generationId": "gen-1786079985-xa31oVrBOVCdQinyiphs"
      }
    ],
    "fallback": false
  },
  "usage": {
    "promptTokens": 3048,
    "completionTokens": 56,
    "costUsd": 0.0012815544
  },
  "assertions": [
    {
      "id": "player-alive",
      "observed": true,
      "operator": "=",
      "threshold": true,
      "passed": true
    },
    {
      "id": "active-defense-post-in-zone",
      "observed": false,
      "operator": "=",
      "threshold": true,
      "passed": false
    }
  ],
  "diagnostics": {
    "finalTick": 4703,
    "finalTileCount": 531893,
    "finalTroops": 3876918,
    "finalTroopCapacityPercent": 61.5226853281681,
    "initialTileCount": 506680,
    "initialTroops": 3682885,
    "initialTroopCapacityPercent": 59.932525053329364,
    "territoryChange": 25213,
    "terminal": false
  },
  "componentCoverage": 0.5,
  "taskScore": 0,
  "artifactPath": "artifacts/c6f4c0c9-0a7e-4ba2-855f-09df86222a98.capability.json.gz"
}
