{
  "schemaVersion": "benchmark-trial-v1",
  "benchmarkVersion": "openfront-bench-v0.1",
  "manifestHash": "f5b931094973115a036ee8f7bea5c92d2012d62b7d77f99e97c4facd0ee66a60",
  "runId": "dbdeb06c-7f67-4387-b755-77e9a11e5ae0",
  "trialId": "357f3bd4-bc97-4942-949a-fbbfd1b9b7cb",
  "taskId": "cap-split-front-prioritization-scored-europe-classic-001",
  "suite": "capability",
  "split": "scored",
  "status": "valid",
  "invalidReason": null,
  "model": {
    "requested": "z-ai/glm-5.2",
    "resolved": "z-ai/glm-5.2",
    "provider": "Baidu",
    "requestedProvider": "Baidu",
    "promptVersion": "agent-v13",
    "reasoningEffort": "none"
  },
  "startedAt": "2026-08-07T08:14:09.094Z",
  "completedAt": "2026-08-07T08:14:13.865Z",
  "hashes": {
    "checkpoint": 7085039232693999,
    "final": 9081791686670040
  },
  "attempts": {
    "failures": [],
    "timings": [
      {
        "attempt": 1,
        "totalMs": 2833.763667,
        "timeToFirstTokenMs": 2302.1764999999996,
        "generationMs": 531.5871670000006,
        "completionTokens": 53,
        "timePerOutputTokenMs": 10.222830134615396,
        "queueMs": null,
        "generationId": "gen-1786090450-3KqfEI4EPvQvVeZtM283"
      }
    ],
    "fallback": false
  },
  "usage": {
    "promptTokens": 2774,
    "completionTokens": 53,
    "costUsd": 0.0010947552
  },
  "assertions": [
    {
      "id": "player-alive",
      "observed": true,
      "operator": "=",
      "threshold": true,
      "passed": true
    },
    {
      "id": "priority-frontier-held",
      "observed": 43,
      "operator": "<=",
      "threshold": 100,
      "passed": true
    },
    {
      "id": "combined-frontier-loss-limited",
      "observed": 224,
      "operator": "<=",
      "threshold": 300,
      "passed": true
    }
  ],
  "diagnostics": {
    "finalTick": 3703,
    "finalTileCount": 271338,
    "finalTroops": 2871543,
    "finalTroopCapacityPercent": 67.72038742869316,
    "initialTileCount": 273309,
    "initialTroops": 2393873,
    "initialTroopCapacityPercent": 56.24521717560135,
    "territoryChange": -1971,
    "terminal": false
  },
  "componentCoverage": 1,
  "taskScore": 100,
  "artifactPath": "artifacts/357f3bd4-bc97-4942-949a-fbbfd1b9b7cb.capability.json.gz"
}
