{
  "schemaVersion": "benchmark-trial-v1",
  "benchmarkVersion": "openfront-bench-v0.1",
  "manifestHash": "f5b931094973115a036ee8f7bea5c92d2012d62b7d77f99e97c4facd0ee66a60",
  "runId": "49e3d63c-0c3c-48f0-92b2-570571df62d7",
  "trialId": "2866daeb-04ae-4e42-81b9-9ff94e882c8b",
  "taskId": "cap-neutral-expansion-scored-great-lakes-001",
  "suite": "capability",
  "split": "scored",
  "status": "valid",
  "invalidReason": null,
  "model": {
    "requested": "z-ai/glm-5.2",
    "resolved": "z-ai/glm-5.2",
    "provider": "Baidu",
    "requestedProvider": "baidu",
    "promptVersion": "agent-v13",
    "reasoningEffort": "none"
  },
  "startedAt": "2026-08-07T04:45:02.300Z",
  "completedAt": "2026-08-07T04:45:05.360Z",
  "hashes": {
    "checkpoint": 408768051800988,
    "final": 503142291168935
  },
  "attempts": {
    "failures": [],
    "timings": [
      {
        "attempt": 1,
        "totalMs": 2499.744625,
        "timeToFirstTokenMs": 1954.4382499999997,
        "generationMs": 545.3063750000001,
        "completionTokens": 37,
        "timePerOutputTokenMs": 15.14739930555556,
        "queueMs": null,
        "generationId": "gen-1786077903-Ze7mvdUbo6uNrCQnYL7X"
      }
    ],
    "fallback": false
  },
  "usage": {
    "promptTokens": 2558,
    "completionTokens": 37,
    "costUsd": 0.0010143
  },
  "assertions": [
    {
      "id": "owns-checkpoint-neutral-tile",
      "observed": 24,
      "operator": ">=",
      "threshold": 1,
      "passed": true
    }
  ],
  "diagnostics": {
    "finalTick": 353,
    "finalTileCount": 4347,
    "finalTroops": 66421,
    "finalTroopCapacityPercent": 16.41037491261431,
    "initialTileCount": 52,
    "initialTroops": 105064,
    "initialTroopCapacityPercent": 86.53599028421725,
    "territoryChange": 4295,
    "terminal": false
  },
  "componentCoverage": 1,
  "taskScore": 100,
  "artifactPath": "artifacts/2866daeb-04ae-4e42-81b9-9ff94e882c8b.capability.json.gz"
}
