{
  "schemaVersion": "benchmark-trial-v1",
  "benchmarkVersion": "openfront-bench-v0.1",
  "manifestHash": "f5b931094973115a036ee8f7bea5c92d2012d62b7d77f99e97c4facd0ee66a60",
  "runId": "dbdeb06c-7f67-4387-b755-77e9a11e5ae0",
  "trialId": "466ac30e-2c6a-42a7-aef9-53e0ce3b6190",
  "taskId": "cap-weaker-target-selection-scored-europe-classic-001",
  "suite": "capability",
  "split": "scored",
  "status": "valid",
  "invalidReason": null,
  "model": {
    "requested": "z-ai/glm-5.2",
    "resolved": "z-ai/glm-5.2",
    "provider": "Baidu",
    "requestedProvider": "Baidu",
    "promptVersion": "agent-v13",
    "reasoningEffort": "none"
  },
  "startedAt": "2026-08-07T09:57:35.503Z",
  "completedAt": "2026-08-07T09:57:40.252Z",
  "hashes": {
    "checkpoint": 7085039232693999,
    "final": 9133023458895224
  },
  "attempts": {
    "failures": [],
    "timings": [
      {
        "attempt": 1,
        "totalMs": 2723.414125,
        "timeToFirstTokenMs": 2106.7442910000004,
        "generationMs": 616.6698339999994,
        "completionTokens": 50,
        "timePerOutputTokenMs": 12.58509865306121,
        "queueMs": null,
        "generationId": "gen-1786096657-x24tDxk3vD9fgngyxnmc"
      }
    ],
    "fallback": false
  },
  "usage": {
    "promptTokens": 3178,
    "completionTokens": 50,
    "costUsd": 0.0012446784
  },
  "assertions": [
    {
      "id": "captures-target-tile",
      "observed": 1222,
      "operator": ">=",
      "threshold": 1,
      "passed": true
    }
  ],
  "diagnostics": {
    "finalTick": 3703,
    "finalTileCount": 296056,
    "finalTroops": 2954806,
    "finalTroopCapacityPercent": 66.61291406861204,
    "initialTileCount": 273309,
    "initialTroops": 2393873,
    "initialTroopCapacityPercent": 56.24521717560135,
    "territoryChange": 22747,
    "terminal": false
  },
  "componentCoverage": 1,
  "taskScore": 100,
  "artifactPath": "artifacts/466ac30e-2c6a-42a7-aef9-53e0ce3b6190.capability.json.gz"
}
