{
  "schemaVersion": "benchmark-trial-v1",
  "benchmarkVersion": "openfront-bench-v0.1",
  "manifestHash": "f5b931094973115a036ee8f7bea5c92d2012d62b7d77f99e97c4facd0ee66a60",
  "runId": "75d8ce77-ea60-4565-b24a-4383325d5ae8",
  "trialId": "5f20c617-718f-4e3a-bf0c-29581f134f11",
  "taskId": "cap-weaker-target-selection-scored-europe-classic-001",
  "suite": "capability",
  "split": "scored",
  "status": "valid",
  "invalidReason": null,
  "model": {
    "requested": "deepseek/deepseek-v4-flash-0731",
    "resolved": "deepseek/deepseek-v4-flash-0731",
    "provider": "Cloudflare",
    "requestedProvider": "Cloudflare",
    "promptVersion": "agent-v13",
    "reasoningEffort": "none"
  },
  "startedAt": "2026-08-07T13:12:31.332Z",
  "completedAt": "2026-08-07T13:12:34.750Z",
  "hashes": {
    "checkpoint": 7085039232693999,
    "final": 8556972751410073
  },
  "attempts": {
    "failures": [],
    "timings": [
      {
        "attempt": 1,
        "totalMs": 1366.1218750000003,
        "timeToFirstTokenMs": 772.1704160000004,
        "generationMs": 593.9514589999999,
        "completionTokens": 31,
        "timePerOutputTokenMs": 19.798381966666664,
        "queueMs": null,
        "generationId": "gen-1786108353-wVC36Uts7DcZDj2zEjHb"
      }
    ],
    "fallback": false
  },
  "usage": {
    "promptTokens": 3242,
    "completionTokens": 31,
    "costUsd": 0.000433888
  },
  "assertions": [
    {
      "id": "captures-target-tile",
      "observed": 1222,
      "operator": ">=",
      "threshold": 1,
      "passed": true
    }
  ],
  "diagnostics": {
    "finalTick": 3703,
    "finalTileCount": 325248,
    "finalTroops": 2599591,
    "finalTroopCapacityPercent": 55.8039352694219,
    "initialTileCount": 273309,
    "initialTroops": 2393873,
    "initialTroopCapacityPercent": 56.24521717560135,
    "territoryChange": 51939,
    "terminal": false
  },
  "componentCoverage": 1,
  "taskScore": 100,
  "artifactPath": "artifacts/5f20c617-718f-4e3a-bf0c-29581f134f11.capability.json.gz"
}
