{
  "schemaVersion": "benchmark-trial-v1",
  "benchmarkVersion": "openfront-bench-v0.1",
  "manifestHash": "f5b931094973115a036ee8f7bea5c92d2012d62b7d77f99e97c4facd0ee66a60",
  "runId": "49e3d63c-0c3c-48f0-92b2-570571df62d7",
  "trialId": "86fe36d4-5c1a-4a3b-9d67-be5c702888f6",
  "taskId": "cap-saturated-capacity-expansion-scored-world-001",
  "suite": "capability",
  "split": "scored",
  "status": "valid",
  "invalidReason": null,
  "model": {
    "requested": "z-ai/glm-5.2",
    "resolved": "z-ai/glm-5.2",
    "provider": "Baidu",
    "requestedProvider": "baidu",
    "promptVersion": "agent-v13",
    "reasoningEffort": "none"
  },
  "startedAt": "2026-08-07T05:26:17.627Z",
  "completedAt": "2026-08-07T05:26:21.168Z",
  "hashes": {
    "checkpoint": 1433033086910016,
    "final": 1494221669685525
  },
  "attempts": {
    "failures": [],
    "timings": [
      {
        "attempt": 1,
        "totalMs": 2702.755542,
        "timeToFirstTokenMs": 2048.548583,
        "generationMs": 654.2069590000001,
        "completionTokens": 37,
        "timePerOutputTokenMs": 18.17241552777778,
        "queueMs": null,
        "generationId": "gen-1786080378-7wBsyKtclhCtlqYjksLF"
      }
    ],
    "fallback": false
  },
  "usage": {
    "promptTokens": 2673,
    "completionTokens": 37,
    "costUsd": 0.0011045328
  },
  "assertions": [
    {
      "id": "owns-checkpoint-neutral-tile",
      "observed": 24,
      "operator": ">=",
      "threshold": 1,
      "passed": true
    }
  ],
  "diagnostics": {
    "finalTick": 1103,
    "finalTileCount": 5006,
    "finalTroops": 65620,
    "finalTroopCapacityPercent": 15.200934538353433,
    "initialTileCount": 52,
    "initialTroops": 121318,
    "initialTroopCapacityPercent": 99.92360151241783,
    "territoryChange": 4954,
    "terminal": false
  },
  "componentCoverage": 1,
  "taskScore": 100,
  "artifactPath": "artifacts/86fe36d4-5c1a-4a3b-9d67-be5c702888f6.capability.json.gz"
}
