{
  "schemaVersion": "benchmark-trial-v1",
  "benchmarkVersion": "openfront-bench-v0.1",
  "manifestHash": "f5b931094973115a036ee8f7bea5c92d2012d62b7d77f99e97c4facd0ee66a60",
  "runId": "49e3d63c-0c3c-48f0-92b2-570571df62d7",
  "trialId": "ee172503-95af-47cd-9197-800ba1dfd060",
  "taskId": "cap-naval-target-recognition-scored-strait-of-gibraltar-001",
  "suite": "capability",
  "split": "scored",
  "status": "valid",
  "invalidReason": null,
  "model": {
    "requested": "z-ai/glm-5.2",
    "resolved": "z-ai/glm-5.2",
    "provider": "Baidu",
    "requestedProvider": "baidu",
    "promptVersion": "agent-v13",
    "reasoningEffort": "none"
  },
  "startedAt": "2026-08-07T04:24:05.843Z",
  "completedAt": "2026-08-07T04:24:11.763Z",
  "hashes": {
    "checkpoint": "11624210940139620",
    "final": 9151510202852736
  },
  "attempts": {
    "failures": [],
    "timings": [
      {
        "attempt": 1,
        "totalMs": 2600.427583,
        "timeToFirstTokenMs": 1824.900583,
        "generationMs": 775.527,
        "completionTokens": 47,
        "timePerOutputTokenMs": 16.859282608695654,
        "queueMs": null,
        "generationId": "gen-1786076648-Qql5m0suDWiecxaTe3FT"
      }
    ],
    "fallback": false
  },
  "usage": {
    "promptTokens": 2251,
    "completionTokens": 47,
    "costUsd": 0.000881748
  },
  "assertions": [
    {
      "id": "captures-target-tile",
      "observed": 179312,
      "operator": ">=",
      "threshold": 1,
      "passed": true
    }
  ],
  "diagnostics": {
    "finalTick": 5003,
    "finalTileCount": 411690,
    "finalTroops": 2524318,
    "finalTroopCapacityPercent": 52.86642213181371,
    "initialTileCount": 314238,
    "initialTroops": 4009388,
    "initialTroopCapacityPercent": 98.37926399977185,
    "territoryChange": 97452,
    "terminal": false
  },
  "componentCoverage": 1,
  "taskScore": 100,
  "artifactPath": "artifacts/ee172503-95af-47cd-9197-800ba1dfd060.capability.json.gz"
}
