{
  "schemaVersion": "benchmark-trial-v1",
  "benchmarkVersion": "openfront-bench-v0.1",
  "manifestHash": "f5b931094973115a036ee8f7bea5c92d2012d62b7d77f99e97c4facd0ee66a60",
  "runId": "41cf072f-c069-4d7a-be63-3af8c3890c2a",
  "trialId": "5b7e5680-b2db-4c27-a2bc-c3c756c1d9f2",
  "taskId": "cap-saturated-capacity-expansion-scored-world-001",
  "suite": "capability",
  "split": "scored",
  "status": "valid",
  "invalidReason": null,
  "model": {
    "requested": "openai/gpt-5.6-luna",
    "resolved": "openai/gpt-5.6-luna",
    "provider": "OpenAI",
    "requestedProvider": "OpenAI",
    "promptVersion": "agent-v13",
    "reasoningEffort": "none"
  },
  "startedAt": "2026-08-07T12:53:35.693Z",
  "completedAt": "2026-08-07T12:53:38.187Z",
  "hashes": {
    "checkpoint": 1433033086910016,
    "final": 1494221669685525
  },
  "attempts": {
    "failures": [],
    "timings": [
      {
        "attempt": 1,
        "totalMs": 1886.2646659999998,
        "timeToFirstTokenMs": 959.729083,
        "generationMs": 926.5355829999999,
        "completionTokens": 41,
        "timePerOutputTokenMs": 23.163389574999997,
        "queueMs": null,
        "generationId": "gen-1786107216-UJkqKPNEuzdfeWe5aBnf"
      }
    ],
    "fallback": false
  },
  "usage": {
    "promptTokens": 2860,
    "completionTokens": 41,
    "costUsd": 0.00005347
  },
  "assertions": [
    {
      "id": "owns-checkpoint-neutral-tile",
      "observed": 24,
      "operator": ">=",
      "threshold": 1,
      "passed": true
    }
  ],
  "diagnostics": {
    "finalTick": 1103,
    "finalTileCount": 5006,
    "finalTroops": 65620,
    "finalTroopCapacityPercent": 15.200934538353433,
    "initialTileCount": 52,
    "initialTroops": 121318,
    "initialTroopCapacityPercent": 99.92360151241783,
    "territoryChange": 4954,
    "terminal": false
  },
  "componentCoverage": 1,
  "taskScore": 100,
  "artifactPath": "artifacts/5b7e5680-b2db-4c27-a2bc-c3c756c1d9f2.capability.json.gz"
}
