{
  "schemaVersion": "benchmark-trial-v1",
  "benchmarkVersion": "openfront-bench-v0.1",
  "manifestHash": "f5b931094973115a036ee8f7bea5c92d2012d62b7d77f99e97c4facd0ee66a60",
  "runId": "41cf072f-c069-4d7a-be63-3af8c3890c2a",
  "trialId": "c6c6ba0b-f202-4ea5-8d8e-2d1dd995679b",
  "taskId": "cap-split-front-prioritization-scored-europe-classic-001",
  "suite": "capability",
  "split": "scored",
  "status": "valid",
  "invalidReason": null,
  "model": {
    "requested": "openai/gpt-5.6-luna",
    "resolved": "openai/gpt-5.6-luna",
    "provider": "OpenAI",
    "requestedProvider": "OpenAI",
    "promptVersion": "agent-v13",
    "reasoningEffort": "none"
  },
  "startedAt": "2026-08-07T11:42:04.264Z",
  "completedAt": "2026-08-07T11:42:07.741Z",
  "hashes": {
    "checkpoint": 7085039232693999,
    "final": 9081791686670040
  },
  "attempts": {
    "failures": [],
    "timings": [
      {
        "attempt": 1,
        "totalMs": 1546.383833,
        "timeToFirstTokenMs": 1193.6885829999999,
        "generationMs": 352.6952500000002,
        "completionTokens": 49,
        "timePerOutputTokenMs": 7.347817708333338,
        "queueMs": null,
        "generationId": "gen-1786102926-f3UZiZmvinBBori0quRg"
      }
    ],
    "fallback": false
  },
  "usage": {
    "promptTokens": 2969,
    "completionTokens": 49,
    "costUsd": 0.00040045
  },
  "assertions": [
    {
      "id": "player-alive",
      "observed": true,
      "operator": "=",
      "threshold": true,
      "passed": true
    },
    {
      "id": "priority-frontier-held",
      "observed": 43,
      "operator": "<=",
      "threshold": 100,
      "passed": true
    },
    {
      "id": "combined-frontier-loss-limited",
      "observed": 224,
      "operator": "<=",
      "threshold": 300,
      "passed": true
    }
  ],
  "diagnostics": {
    "finalTick": 3703,
    "finalTileCount": 271338,
    "finalTroops": 2871543,
    "finalTroopCapacityPercent": 67.72038742869316,
    "initialTileCount": 273309,
    "initialTroops": 2393873,
    "initialTroopCapacityPercent": 56.24521717560135,
    "territoryChange": -1971,
    "terminal": false
  },
  "componentCoverage": 1,
  "taskScore": 100,
  "artifactPath": "artifacts/c6c6ba0b-f202-4ea5-8d8e-2d1dd995679b.capability.json.gz"
}
