{
  "schemaVersion": "benchmark-trial-v1",
  "benchmarkVersion": "openfront-bench-v0.1",
  "manifestHash": "f5b931094973115a036ee8f7bea5c92d2012d62b7d77f99e97c4facd0ee66a60",
  "runId": "75d8ce77-ea60-4565-b24a-4383325d5ae8",
  "trialId": "02931a8c-5f36-4cc8-b508-7760c21a833d",
  "taskId": "cap-losing-attack-retreat-scored-world-001",
  "suite": "capability",
  "split": "scored",
  "status": "valid",
  "invalidReason": null,
  "model": {
    "requested": "deepseek/deepseek-v4-flash-0731",
    "resolved": "deepseek/deepseek-v4-flash-0731",
    "provider": "Cloudflare",
    "requestedProvider": "Cloudflare",
    "promptVersion": "agent-v13",
    "reasoningEffort": "none"
  },
  "startedAt": "2026-08-07T14:07:03.507Z",
  "completedAt": "2026-08-07T14:07:05.875Z",
  "hashes": {
    "checkpoint": 6485841698171295,
    "final": 7314113338152560
  },
  "attempts": {
    "failures": [],
    "timings": [
      {
        "attempt": 1,
        "totalMs": 1197.364625,
        "timeToFirstTokenMs": 643.3540419999999,
        "generationMs": 554.010583,
        "completionTokens": 43,
        "timePerOutputTokenMs": 13.190728166666666,
        "queueMs": null,
        "generationId": "gen-1786111624-H9VXGFRiJvDFpKGX9rDI"
      }
    ],
    "fallback": false
  },
  "usage": {
    "promptTokens": 3127,
    "completionTokens": 43,
    "costUsd": 0.000421148
  },
  "assertions": [
    {
      "id": "player-alive",
      "observed": true,
      "operator": "=",
      "threshold": true,
      "passed": true
    },
    {
      "id": "original-attack-ended",
      "observed": true,
      "operator": "=",
      "threshold": false,
      "passed": false
    },
    {
      "id": "troops-recovered",
      "observed": 163509,
      "operator": ">=",
      "threshold": 250000,
      "passed": false
    },
    {
      "id": "territory-preserved",
      "observed": 2918,
      "operator": ">=",
      "threshold": 2124,
      "passed": true
    }
  ],
  "diagnostics": {
    "finalTick": 1903,
    "finalTileCount": 2918,
    "finalTroops": 163509,
    "finalTroopCapacityPercent": 48.101050139161075,
    "initialTileCount": 2124,
    "initialTroops": 84018,
    "initialTroopCapacityPercent": 28.165605573904294,
    "territoryChange": 794,
    "terminal": false
  },
  "componentCoverage": 0.5,
  "taskScore": 0,
  "artifactPath": "artifacts/02931a8c-5f36-4cc8-b508-7760c21a833d.capability.json.gz"
}
