{
  "schemaVersion": "benchmark-trial-v1",
  "benchmarkVersion": "openfront-bench-v0.1",
  "manifestHash": "f5b931094973115a036ee8f7bea5c92d2012d62b7d77f99e97c4facd0ee66a60",
  "runId": "dbdeb06c-7f67-4387-b755-77e9a11e5ae0",
  "trialId": "763c5887-7726-4f04-ae54-f85e94062553",
  "taskId": "cap-construction-failure-recovery-scored-europe-classic-001",
  "suite": "capability",
  "split": "scored",
  "status": "valid",
  "invalidReason": null,
  "model": {
    "requested": "z-ai/glm-5.2",
    "resolved": "z-ai/glm-5.2",
    "provider": "Baidu",
    "requestedProvider": "Baidu",
    "promptVersion": "agent-v13",
    "reasoningEffort": "none"
  },
  "startedAt": "2026-08-07T10:41:03.471Z",
  "completedAt": "2026-08-07T10:41:08.686Z",
  "hashes": {
    "checkpoint": "10050961651835828",
    "final": 10694620607358246
  },
  "attempts": {
    "failures": [],
    "timings": [
      {
        "attempt": 1,
        "totalMs": 2694.8265420000002,
        "timeToFirstTokenMs": 2172.3513749999997,
        "generationMs": 522.4751670000005,
        "completionTokens": 57,
        "timePerOutputTokenMs": 9.32991369642858,
        "queueMs": null,
        "generationId": "gen-1786099265-RlwKiQV7nO4dfgty9dNa"
      }
    ],
    "fallback": false
  },
  "usage": {
    "promptTokens": 3048,
    "completionTokens": 57,
    "costUsd": 0.001314936
  },
  "assertions": [
    {
      "id": "player-alive",
      "observed": true,
      "operator": "=",
      "threshold": true,
      "passed": true
    },
    {
      "id": "active-defense-post-in-zone",
      "observed": false,
      "operator": "=",
      "threshold": true,
      "passed": false
    }
  ],
  "diagnostics": {
    "finalTick": 4703,
    "finalTileCount": 549510,
    "finalTroops": 3554055,
    "finalTroopCapacityPercent": 55.45205798428749,
    "initialTileCount": 506680,
    "initialTroops": 3682885,
    "initialTroopCapacityPercent": 59.932525053329364,
    "territoryChange": 42830,
    "terminal": false
  },
  "componentCoverage": 0.5,
  "taskScore": 0,
  "artifactPath": "artifacts/763c5887-7726-4f04-ae54-f85e94062553.capability.json.gz"
}
