{
  "schemaVersion": "benchmark-trial-v1",
  "benchmarkVersion": "openfront-bench-v0.1",
  "manifestHash": "f5b931094973115a036ee8f7bea5c92d2012d62b7d77f99e97c4facd0ee66a60",
  "runId": "49e3d63c-0c3c-48f0-92b2-570571df62d7",
  "trialId": "44431902-e3d8-4721-8ee0-abe2e804ba47",
  "taskId": "cap-incoming-attack-response-scored-great-lakes-001",
  "suite": "capability",
  "split": "scored",
  "status": "valid",
  "invalidReason": null,
  "model": {
    "requested": "z-ai/glm-5.2",
    "resolved": "z-ai/glm-5.2",
    "provider": "Baidu",
    "requestedProvider": "baidu",
    "promptVersion": "agent-v13",
    "reasoningEffort": "none"
  },
  "startedAt": "2026-08-07T05:49:58.106Z",
  "completedAt": "2026-08-07T05:50:06.479Z",
  "hashes": {
    "checkpoint": 3736637310375356,
    "final": 2315780367427505
  },
  "attempts": {
    "failures": [
      {
        "attempt": 1,
        "code": "rate_limited",
        "message": "OpenRouter 429: {\"error\":{\"message\":\"Provider returned error\",\"code\":429,\"metadata\":{\"raw\":\"z-ai/glm-5.2 is temporarily rate-limited upstream. Please retry shortly, or add your own key to accumulate your rate limits: https://openrouter.ai/settings/integrations\",\"provider_name\":\"Baidu\",\"is_byok\":false,\"provider_error_code\":\"tpm_rate_limit_exceeded\",\"limit_source\":\"upstream_provider_shared_pool\",\"remedy_hint\":\"Retry shortly, add your own provider key (https://openrouter.ai/settings/integrations), ",
        "rejectedActionIds": [],
        "httpStatus": 429,
        "retryDelayMs": 5000
      }
    ],
    "timings": [
      {
        "attempt": 1,
        "totalMs": 385.5384590000001,
        "timeToFirstTokenMs": null,
        "generationMs": null,
        "completionTokens": 0,
        "timePerOutputTokenMs": null,
        "queueMs": null,
        "generationId": null
      },
      {
        "attempt": 2,
        "totalMs": 1760.0327920000009,
        "timeToFirstTokenMs": 963.6095000000005,
        "generationMs": 796.4232920000004,
        "completionTokens": 46,
        "timePerOutputTokenMs": 17.698295377777786,
        "queueMs": null,
        "generationId": "gen-1786081804-hnHYfI3fvFZlSMaxBrDu"
      }
    ],
    "fallback": false
  },
  "usage": {
    "promptTokens": 2444,
    "completionTokens": 46,
    "costUsd": 0.00096138
  },
  "assertions": [
    {
      "id": "player-alive",
      "observed": true,
      "operator": "=",
      "threshold": true,
      "passed": true
    },
    {
      "id": "protected-frontier-held",
      "observed": 118,
      "operator": "<=",
      "threshold": 200,
      "passed": true
    }
  ],
  "diagnostics": {
    "finalTick": 2003,
    "finalTileCount": 153753,
    "finalTroops": 1074572,
    "finalTroopCapacityPercent": 39.962469690593466,
    "initialTileCount": 155072,
    "initialTroops": 679890,
    "initialTroopCapacityPercent": 25.16008790274085,
    "territoryChange": -1319,
    "terminal": false
  },
  "componentCoverage": 1,
  "taskScore": 100,
  "artifactPath": "artifacts/44431902-e3d8-4721-8ee0-abe2e804ba47.capability.json.gz"
}
