{
  "schemaVersion": "benchmark-trial-v1",
  "benchmarkVersion": "openfront-bench-v0.1",
  "manifestHash": "f5b931094973115a036ee8f7bea5c92d2012d62b7d77f99e97c4facd0ee66a60",
  "runId": "49e3d63c-0c3c-48f0-92b2-570571df62d7",
  "trialId": "f890aa2a-2d00-4b85-87b6-80f5327615b9",
  "taskId": "cap-post-expansion-recovery-scored-europe-classic-001",
  "suite": "capability",
  "split": "scored",
  "status": "valid",
  "invalidReason": null,
  "model": {
    "requested": "z-ai/glm-5.2",
    "resolved": "z-ai/glm-5.2",
    "provider": "Baidu",
    "requestedProvider": "baidu",
    "promptVersion": "agent-v13",
    "reasoningEffort": "none"
  },
  "startedAt": "2026-08-07T04:58:17.326Z",
  "completedAt": "2026-08-07T04:58:20.329Z",
  "hashes": {
    "checkpoint": 127918484471915,
    "final": 252183512853959
  },
  "attempts": {
    "failures": [],
    "timings": [
      {
        "attempt": 1,
        "totalMs": 2623.321334,
        "timeToFirstTokenMs": 1951.976417,
        "generationMs": 671.3449169999999,
        "completionTokens": 41,
        "timePerOutputTokenMs": 16.783622924999996,
        "queueMs": null,
        "generationId": "gen-1786078697-7GcgPEOSdiFI3MIp2uzj"
      }
    ],
    "fallback": false
  },
  "usage": {
    "promptTokens": 2397,
    "completionTokens": 41,
    "costUsd": 0.0009048648
  },
  "assertions": [
    {
      "id": "player-alive",
      "observed": true,
      "operator": "=",
      "threshold": true,
      "passed": true
    },
    {
      "id": "capacity-increased",
      "observed": 36.44237731366844,
      "operator": ">",
      "threshold": 19.294935428730952,
      "passed": true
    },
    {
      "id": "territory-preserved",
      "observed": 736,
      "operator": ">=",
      "threshold": 373,
      "passed": true
    },
    {
      "id": "recovery-avoids-new-expansion",
      "observed": 363,
      "operator": "<=",
      "threshold": 100,
      "passed": false
    }
  ],
  "diagnostics": {
    "finalTick": 145,
    "finalTileCount": 736,
    "finalTroops": 74704,
    "finalTroopCapacityPercent": 36.44237731366844,
    "initialTileCount": 373,
    "initialTroops": 32769,
    "initialTroopCapacityPercent": 19.294935428730952,
    "territoryChange": 363,
    "terminal": false
  },
  "componentCoverage": 0.75,
  "taskScore": 0,
  "artifactPath": "artifacts/f890aa2a-2d00-4b85-87b6-80f5327615b9.capability.json.gz"
}
